{
  "$schema": "https://json-schema.org/draft/2020-12/schema",
  "$id": "https://cosmic-vikings/ar-agent/contracts/approval-result.schema.json",
  "title": "ApprovalResult",
  "description": "Outcome of a human approval (§19). Non-reusable: one approval_ref authorizes exactly one idempotent action. `consumed=true` once the authorized action has posted; replay with the same ref is then rejected.",
  "x-contract-version": "1.0.0",
  "x-status": "draft",
  "x-since": "2026-07-06",
  "type": "object",
  "additionalProperties": false,
  "required": ["approval_id", "approval_ref", "decision", "decided_by", "decided_at", "trace_id", "contract_version"],
  "properties": {
    "approval_id": {"type": "string", "pattern": "^[0-9a-f]{8}-[0-9a-f]{4}-[0-9a-f]{4}-[0-9a-f]{4}-[0-9a-f]{12}$"},
    "approval_ref": {"type": "string", "pattern": "^ar-approval-[0-9a-f]{8}-[0-9a-f]{4}-[0-9a-f]{4}-[0-9a-f]{4}-[0-9a-f]{12}$", "description": "The non-reusable authorization reference (§19)."},
    "decision": {"type": "string", "enum": ["approved", "rejected", "expired"]},
    "decided_by": {"type": "string", "minLength": 1, "description": "Keycloak sub of the approver (§13/§19)."},
    "decided_at": {"type": "string", "pattern": "^\\d{4}-\\d{2}-\\d{2}T\\d{2}:\\d{2}:\\d{2}Z$"},
    "trace_id": {"type": "string", "minLength": 1},
    "tier": {"type": "string", "enum": ["read-only", "auto", "approval", "dual-control"]},
    "second_approver_ref": {"type": "string", "minLength": 1, "description": "Required for dual-control: the second distinct approver's Keycloak sub (§19)."},
    "idempotency_key": {"type": "string", "pattern": "^ar-idem:[a-z_]+:[a-z0-9_-]+:[a-z0-9_-]+$", "description": "The key to replay on the authorized POST (§10)."},
    "reason": {"type": "string", "description": "Approver-supplied reason (reject/expire); no PII/secrets (§16)."},
    "consumed": {"type": "boolean", "default": false, "description": "True once the authorized action has posted; further replay is rejected (§19 non-reusable)."},
    "contract_version": {"type": "string", "pattern": "^\\d+\\.\\d+\\.\\d+$"}
  }
}